username,author_id,tweet_id,texto,text
Parisi_oficial,1325658454875365376,1460981543229440005,Este 21 daremos la sorpresa.  Este duopolio ya no da para más! Vota inteligente Vota PARISI VOTA LISTA AB https,This 21 we'll surprise you.  This duopoly is no longer enough! Vote smart Vote PARISI VOTE AB LIST https
Parisi_oficial,1325658454875365376,1460809711276679172,Las Pymes y MiPymes necesitan apoyo real  incentivos para contratación  pagar menos impuestos y de un gobierno que sepa de economía  cifras y gestión pública que incentive la producción  el consumo y que termine con los apitutados y operadores políticos de izquierda y derecha. https,SMEs and MSMEs need real support  incentives to recruit  pay less taxes  and a government that knows about economics  figures and public management that encourages production  consumption and ends up with left-wing and right-wing political operators. https
Parisi_oficial,1325658454875365376,1460809140364795910,Tal como adelanté hace semanas Piñera haría todo lo posible para salvarse en el Senado  "manejando" a los senadores  donde era acusado por la denuncia de corrupción de los Pandora Papers. La izquierda y la derecha siempre se salvan solos. https,As I said weeks ago Piñera would do everything possible to save himself in the Senate  handling the senators  where he was accused of the corruption allegation of the Pandora Papers. The left and the right are always saved by themselves. https
Parisi_oficial,1325658454875365376,1460779427747405833,Nuestras propuestas. Vota Parisi y juntos cambiemos Chile.  Eliminación de IVA a toda la canasta básica y a los remedios.  Reducción de 200 pesos por litro de bencina.  Duplicar pensión básica y cambiar sistema AFP por modelo canadiense: tripartito.  Reestructurar el SENAME.  https,Our proposals. Vote Parisi and together let's change Chile.  Elimination of VAT on all basic basket and remedies.  Reduction of 200 pesos per litre of benzine.  Double basic pension and change AFP system to Canadian model: tripartite.  Restructure SENAME.  https
Parisi_oficial,1325658454875365376,1460762081087610885,#ParisiA2Vuelta y Chile al Mundial! Grande Chile! vamos con todo Muchachos!,#ParisiA2Vuelta and Chile to the World Cup! Great Chile! let's go with everything Boys!
Parisi_oficial,1325658454875365376,1460733526597328900,Hola Sergio ️. De qué parte del Sur eres? Gracias por tu apoyo. Necesitamos muchos jóvenes para cambiar Chile bienvenido al Poder de La Gente. https,Hello Sergio ️. What part of the South are you from? Thank you for your support. We need many young people to change Chile welcome to the Power of People. https
Parisi_oficial,1325658454875365376,1460725286551576576,Tendencia en Chile #ParisiA2Vuelta 64 3 mil Tweets,Trend in Chile #ParisiA2Vuelta 64.3K Tweets
Parisi_oficial,1325658454875365376,1460722590134140930,¿Cómo Chile llegó a ser tan miserable que te cobra el IVA al comprar una silla de ruedas  medicamentos  pan  leche o por el queso mientras los operadores políticos se pagan sueldazos?  Eso es injusto y debe terminar  sólo el poder de la gente lo puede cambiar.,How did Chile become so miserable that it charges you VAT when you buy a wheelchair  medicine  bread  milk or cheese while political operators pay salaries?  That is unfair and must end  only the power of the people can change it.
Parisi_oficial,1325658454875365376,1460715929378050049,El candidato de Piñera @sebastiansichel corrigió al candidato de la ultra derecha @joseantoniokast. Los dos están equivocados  Con la economía chilena no se puede improvisar  acá les dejo la explicación técnica.  PD: Si se puede reducir impuestos y crecer económicamente. https,Piñera's candidate @sebastiansichel corrected the ultra-right candidate @joseantoniokast. You're both wrong With the Chilean economy you can't improvise  here's the technical explanation.  PS: If you can reduce taxes and grow economically. https
Parisi_oficial,1325658454875365376,1460715031486599171,Diputado y candidato @gabrielboric  borraste el tweet donde llamabas a votar el 21 de diciembre -la elección es el 21 de noviembre- no te preocupes no tienes que agredecernos por corregirte - nuevamente- . https,Deputy and candidate @gabrielboric you deleted the tweet where you called to vote on December 21 - the election is on November 21 - don't worry you don't have to say hassling us for correcting you - again-. https
Parisi_oficial,1325658454875365376,1460712547393355777,GANAMOS EN LAS REDES  EN LA CREATIVIDAD Y GANAREMOS EN LOS VOTOS EL DOMINGO!  https,WE WON IN THE NETWORKS  IN CREATIVITY AND WE WILL WIN IN THE VOTES ON SUNDAY!  https
Parisi_oficial,1325658454875365376,1460711475635314688,Estamos a favor del #CuartoRetiro10xCientoAHORA y tenemos una propuesta para cambiar el sistema de pensiones  que hasta ahora solo ayuda a los grandes grupos económicos. Llevamos mas de 10 años denunciando los abusos del sistema de AFP s.,We are in favour of #CuartoRetiro10xCientoAHORA and we have a proposal to change the pension system  which so far only helps large economic groups. We have been reporting abuses of the AFP system for more than 10 years.
Parisi_oficial,1325658454875365376,1460707074179014669,#CuartoRetiroAhora desde un principio fuimos claros y entregamos las razones.,#CuartoRetiroAhora from the beginning we were clear and gave the reasons.
Parisi_oficial,1325658454875365376,1460706639539884033,El sistema está muy cómodo con esta izquierda y derecha ficticia  que son los mismos revueltos con distintos nombres solamente. Por eso solo confiamos en la gente.  Ayúdanos a construir un nuevo Chile lleno de oportunidades para tod@s. Cambio con seguridad y paz social.,The system is very comfortable with this fictional left and right  which are the same scrambled with different names only. That's why we only trust people.  Help us build a new Chile full of opportunities for tod @s. Change with security and social peace.
Parisi_oficial,1325658454875365376,1460702210959028227,Grande el PDG! con toda la energía que nos caracteriza https,Great the PDG! with all the energy that characterizes us https
Parisi_oficial,1325658454875365376,1460700352622346244,La sociedad ha avanzado mucho más que los retrógrados de los operadores políticos https,Society has advanced far more than the retrogrades of political operators https
Parisi_oficial,1325658454875365376,1460694006434836487,¿Qué te pareció nuestro último video de campaña?  SOMOS LA ÚLTIMA RESISTENCIA AL DUOPOLIO!  https,What did you think of our latest campaign video?  WE ARE THE LAST RESISTANCE TO THE DUOPOLY!  https
Parisi_oficial,1325658454875365376,1460691658417213443,Ahora en vivo conversamos con medio de Noruega. Conversamos con chilenos en el exterior. Todos somos Chile.  https,Now live we talk to the middle of Norway. We talked to Chileans abroad. We are all Chile.  https
Parisi_oficial,1325658454875365376,1460686754680229889,Un abrazo gigante a toda la gente de Pozo Almonte ️. Gracias por tu apoyo Giovana. Ustedes nos dan la   fuerza para ganarle al sistema.  ¡Unidos somos invencibles!  https,A giant hug to all the people of Pozo Almonte ️. Thank you for your support Giovana. You give us the strength to beat the system.  United we are invincible! https
Parisi_oficial,1325658454875365376,1460685929530724355,Tendencia en Chile #ParisiA2Vuelta 62 8 mil Tweets,Trend in Chile #ParisiA2Vuelta 62.8K Tweets
Parisi_oficial,1325658454875365376,1460683458489978886,Gracias Ana por tu apoyo. Solo confiamos en la gente  por eso proponemos Democracia Digital en donde  por primera vez  sean los ciudadanos los que gobiernen. https,Thank you Ana for your support. We only trust people  which is why we propose Digital Democracy where  for the first time  it is the citizens who govern. https
Parisi_oficial,1325658454875365376,1460681466979958786,HOY 19HRS. FORO DEMOCRÁTICO Con la participación de decenas de medios regionales  autogestionados  independientes  de tv  radiales y streaming  ANATEL no es Chile nos vemos familia! https,TODAY 19HRS. DEMOCRATIC FORUM With the participation of dozens of regional  self-managed  independent  tv  radio and streaming media  ANATEL is not Chile see you family! https
Parisi_oficial,1325658454875365376,1460665532017831936,La elección es el 21 de NOVIEMBRE.   El duopolio y el nuevo duopolio toda la vida llegando atrasados... https,The election is on 21 NOVEMBER.   The duopoly and the new duopoly all the life arriving late... https
Parisi_oficial,1325658454875365376,1460663913087848449,Ya pues @gabrielboric. Seriedad por favor. Que espanto estoy impresionado  claramente tienes problemas con las cifras y ahora con las fechas. La elección es el 21 de NOVIEMBRE.  PD: Jóvenes estudien y prepárense para ganarle al sistema. No sean el porro del curso como otros. https,Already @gabrielboric. Seriousness please. I'm impressed  you clearly have problems with the numbers and now with the dates. The election is on 21 NOVEMBER.  PS: Young people study and prepare to beat the system. Don't be the joint of the course like others. https
Parisi_oficial,1325658454875365376,1460661276535713793,El programa económico de @gabrielboric es malo y no cumple con estándares mínimos para la presidencia. Mientras @joseantoniokast está en contra del cuarto retiro de los fondos de las AFP y a favor de aumentar la edad de jubilación a 85 años. El nuevo duopolio es malo para Chile.,@gabrielboric's economic program is bad and does not meet minimum standards for the presidency. While @joseantoniokast is against the fourth withdrawal of AFP funds and in favor of raising the retirement age to 85 years. The new duopoly is bad for Chile.
Parisi_oficial,1325658454875365376,1460659663985209346,El año 2013 fuimos los 1eros en plantear una reforma integral al sistema carcelario  fortalecer la carrera funcionaria en Gendarmería   programas de reinserción laboral para personas privadas de libertad de baja peligrosidad  coordinación de inteligencia intra cárceles. https,In 2013 we were the first to propose a comprehensive reform of the prison system  strengthen the civil service career in the Gendarmerie  labor reintegration programs for people deprived of liberty of low danger  coordination of intra-prison intelligence. https
Parisi_oficial,1325658454875365376,1460652201924202496,Extraordinaria la propuesta del candidato ecologista @gabrielboric   Total como los árboles nos sobran  sigan imprimiendo no más. En campaña los árboles se renuevan solos.   Menos mal se imprimirán pocos   #NoImprimas #CuidaElMedioAmbiente #Recicla #Reduce https,Extraordinary the proposal of the ecologist candidate @gabrielboric   Total as the trees are left over  keep printing no more. In the campaign the trees renew themselves.   Luckily few will be printed   #NoImprimas #CuidaElMedioAmbiente #Recicla #Reduce https
Parisi_oficial,1325658454875365376,1460652160790659073,Hoy a partir de las 16:00 hrs. (Chile) estaremos en una entrevista con Radio Inthemixstyle desde Oslo  Noruega  Un espacio dirigido por chilenos . Chile somos tod@s. Un abrazo a todos los que hacen patria en el extranjero.   En el mundo. https,Today from 16:00 hrs. (Chile) will be in an interview with Radio Inthemixstyle from Oslo  Norway A space directed by Chileans. Chile we are tod @s. A hug to all those who make a homeland abroad.   In the world. https
Parisi_oficial,1325658454875365376,1460650130802032640,"Parisi la Última Resistencia"  Ayúdame a compartir nuestro nuevo video. Dale like  comenta y difunde. Muchas gracias a todos y todas por su apoyo.   #ParisiPresidente #ElProfeParisiNoEstaSolo  https,Parisi the Last Resistance  Help me share our new video. Like  comment and spread. Thank you all very much for your support.   #ParisiPresidente #ElProfeParisiNoEstaSolo  https
Parisi_oficial,1325658454875365376,1460649688747569158,¿Vieron la última Colosal Casa de Papel?  Dejenme sus comentarios. Somos la Última resistencia al duopolio. Dale. RT ayúdame.  https  #elprofeParisiyanoEstáSolo,Did you see the last Colossal House of Paper? Leave me your comments. We are the Last Resistance to the Duopoly. Give it. RT help me.  https  #elprofeParisiyanoEstáSolo
Parisi_oficial,1325658454875365376,1460644868779298822,Somos la última resistencia ciudadana en contra de todos los políticos de siempre.  ¡Ayúdanos a cambiar Chile!️  #ElProfeParisiNoEstaSolo https,We are the last citizen resistance against all the usual politicians.  Help us change Chile! ️  #ElProfeParisiNoEstaSolo https
Parisi_oficial,1325658454875365376,1460641776696496140,¿Ya vieron la nueva colosal?  ¡Espectacular!  Tenemos por lejos al mejor equipo creativo y publicitario de la elección presidencial. Jóvenes profesionales comprometidos de ️ con .  https   #ElProfeParisiNoEstaSolo "La Última Resistencia al Duopolio",Have you seen the new colossal yet?  Spectacular!  We have by far the best creative and advertising team of the presidential election. Young professionals committed to ️ with.  https   #ElProfeParisiNoEstaSolo The Last Resistance to the Duopoly
Parisi_oficial,1325658454875365376,1460632683495575558,Con ideas  conocimiento  astucia  amor a la patria y mucho pero mucho trabajo en equipo  podemos ganarle al sistema inteligentemente para terminar con los abusos  el ninguneo y las injusticias. Con tu voto Chile puede cambiar.  ¡Súmate al Poder de la Gente! ,With ideas  knowledge  cunning  love for the country and a lot but a lot of teamwork  we can beat the system intelligently to end abuses  none and injustices. With your vote Chile can change.  Join the Power of the People! 
Parisi_oficial,1325658454875365376,1460632572648734724,Ya veo porque nos evitan tanto... nuestras ideas no tienen competencia. https,I see why they avoid us so much... our ideas have no competition. https
Parisi_oficial,1325658454875365376,1460631252038340613,El duopolio y todas sus caras más los canales de TV agrupados en ANATEL intentaron censurar nuestro derecho a debatir. ¿Qué hicimos? Construimos nuestro propio debate donde no excluimos a nadie. ¡Muchas gracias a los mas de 47 mil conectados en línea que nos siguieron! ️,The duopoly and all its faces plus the TV channels grouped in ANATEL tried to censor our right to debate. What did we do? We build our own debate where we don't exclude anyone. Many thanks to the more than 47 thousand connected online who followed us! ️
Parisi_oficial,1325658454875365376,1460629809072123913,COLOSAL FINAL: PARISI  LA ÚLTIMA RESISTENCIA | #ElProfeParisiNoEstáSolo https,COLOSSAL FINAL: PARISI  THE LAST RESISTANCE | #ElProfeParisiNoEstáSolo https
Parisi_oficial,1325658454875365376,1460625700575072258,Tenemos claras nuestras prioridades: seguridad ciudadana  empleos dignos y crecimiento económico con oportunidades. Vamos a ser el gobierno que llevará a Chile al desarrollo.  ¡Juntos somos invencibles! ,We are clear about our priorities: citizen security  decent jobs and economic growth with opportunities. We are going to be the government that will lead Chile to development.  Together we are invincible! 
Parisi_oficial,1325658454875365376,1460625429337985024,Estamos comprometidos con cambiar Chile en paz social. Esta elección presidencial es histórica. Queremos que tú y tu familia vivan tranquilos  seguros  felices y que tengan trabajo.  ¡Somos el Poder de la Gente! ️ @ChilePdg,We are committed to changing Chile into social peace. This presidential election is historic. We want you and your family to live calm  safe  happy and have work.  We are the Power of the People! ️ @ChilePdg
Parisi_oficial,1325658454875365376,1460623642312822786,En los próximos 4 años viviremos una verdadera batalla económica post pandemia. Vamos a necesitar astucia  conocimiento y unión de voluntades para salir adelante. Nosotros sabemos como convertir este cambio mundial en una oportunidad para Chile.,In the next 4 years we will experience a real post-pandemic economic battle. We're going to need cunning  knowledge and union of wills to get ahead. We know how to turn this global change into an opportunity for Chile.
Parisi_oficial,1325658454875365376,1460622522362249228,Gracias por tu apoyo. Llegamos para quedarnos  Somos el poder de la gente que llevará a la gente al poder . El mejor equipo para trabajar por Chile y salir de la crisis política  económica y social. ¡El poder de la ideas será imbatible! https,Thank you for your support. We came to stay We are the power of the people who will bring people to power. The best team to work for Chile and get out of the political  economic and social crisis. The power of ideas will be unbeatable! https
Parisi_oficial,1325658454875365376,1460621634751148033,Chile y el mundo cambiaron. Necesitamos un nuevo estilo y estrategia de hacer las cosas. Danos la oportunidad de construir un nuevo país que pueda pararse firme en el mundo y dar el gran salto hacia el desarrollo. ¡Somos el mejor equipo para cambiar Chile ️!,Chile and the world changed. We need a new style and strategy of doing things. Give us the opportunity to build a new country that can stand firm in the world and take the big leap towards development. We are the best team to change Chile ️!
Parisi_oficial,1325658454875365376,1460620753271992322,Cambió el paradigma global. Chile necesita con urgencia prepararse para los nuevos tiempos. Juntos podemos construir los cambios urgentes que los chilenos quieren y se merecen; en paz social  seguridad  crecimiento económico y desarrollo. #ParisiPresidente,It changed the global paradigm. Chile urgently needs to prepare for the new times. Together we can build the urgent changes that Chileans want and deserve; in social peace  security  economic growth and development. #ParisiPresidente
Parisi_oficial,1325658454875365376,1460620309866983430,En el @ChilePdg somos un equipo. Nos coordinamos diariamente con nuestros candiatos y candidatas al Senado  Cámara de Diputados y Cores. Lista AB del poder de la gente. ¡Unidos somos invencibles! https,At @ChilePdg we are a team. We coordinate daily with our candidates for the Senate  Chamber of Deputies and Cores. AB list of people's power. United we are invincible! https
Parisi_oficial,1325658454875365376,1460618995191668743,Hoy a partir de las 16:00 hrs. (Chile) estaremos en una entrevista con Radio Inthemixstyle desde Oslo  Noruega  Un espacio dirigido por  y para chilenos  Transmisión conjunta con #PDGLive https,Today from 16:00 hrs. (Chile) will be in an interview with Radio Inthemixstyle from Oslo  Norway A space directed by and for Chileans  Co-streaming with #PDGLive https
Parisi_oficial,1325658454875365376,1460416894150889474,Escuchando y tratando de entender el plan económico de Boric  #ParisiA2Vuelta https,Listening to and trying to understand Boric's economic plan #ParisiA2Vuelta https
Parisi_oficial,1325658454875365376,1460407593193594881,QUE SE SIENTA EL PODER DE LA GENTE CON RT #ParisiA2Vuelta,FEEL THE POWER OF PEOPLE WITH RT #ParisiA2Vuelta
Parisi_oficial,1325658454875365376,1460407384975761416,Cuál es la mejor propuesta de nuestro programa? Contesta usando  #ParisiA2Vuelta,What is the best proposal of our program? Answer using #ParisiA2Vuelta
Parisi_oficial,1325658454875365376,1460407302482239489,¿Quién va ganando debate? #ParisiA2Vuelta,Who is winning debate? #ParisiA2Vuelta
Parisi_oficial,1325658454875365376,1460402821971550208,CASI 50 MIL CONECTADOS! #DebatePresidencial2021 #ParisiA2vuelta,ALMOST 50 THOUSAND CONNECTED! #DebatePresidencial2021 #ParisiA2vuelta
Parisi_oficial,1325658454875365376,1460400997323493381,#ParisiA2Vuelta #ParisiA2Vuelta #ParisiA2Vuelta #ParisiA2Vuelta,#ParisiA2Vuelta #ParisiA2Vuelta #ParisiA2Vuelta #ParisiA2Vuelta
Parisi_oficial,1325658454875365376,1460398650153218051,TODOS TWITTEANDO #ParisiA2Vuelta TENEMOS 41 MIL CONECTADOS. RÉCORD HISTÓRICO DIGITAL https,EVERYONE TWEETING #ParisiA2Vuelta WE HAVE 41 THOUSAND CONNECTED. DIGITAL HISTORICAL RECORD https
Parisi_oficial,1325658454875365376,1460397815427997703,VAMOS CON TODO #ParisiA2vuelta,LET'S GO WITH EVERYTHING #ParisiA2vuelta
Parisi_oficial,1325658454875365376,1460394295756738571,todos juntos con  #ParisiA2Vuelta,all together with #ParisiA2Vuelta
Parisi_oficial,1325658454875365376,1460394174201618435,VAMOS TODOS CON #ParisiA2Vuelta,LET'S ALL GO WITH #ParisiA2Vuelta
Parisi_oficial,1325658454875365376,1460386067316674568,cuales son las mejores propuestas? #ParisiEnDebateAnatel comenta,what are the best proposals? #ParisiEnDebateAnatel comments
Parisi_oficial,1325658454875365376,1460378290368172044,POR ACÁ EL VERDADERO DEBATE https,HERE IS THE REAL DEBATE https
Parisi_oficial,1325658454875365376,1460372092537479168,YA SOMOS TENDENCIA #PARISIenDebateAnatel,WE ARE ALREADY TREND #PARISIenDebateAnatel
Parisi_oficial,1325658454875365376,1460370105104281603,TODOS! CON #PARISIenDebateAnatel,EVERYONE! WITH #PARISIenDebateAnatel
Parisi_oficial,1325658454875365376,1460349801720168456,Si quieres ver el verdadero DEBATE democrático con todos los candidatos! #PARISIenDebateAnatel   SIGAN PAGINA OFICIAL DE FRANCO PARISI  https,If you want to see the real democratic DEBATE with all the candidates! #PARISIenDebateAnatel   FOLLOW FRANCO PARISI'S OFFICIAL WEBSITE  https
Parisi_oficial,1325658454875365376,1460348355503132678,EL DUOPOLIO SE PREGUNTA QÚÉ ES PDG LIVE SUMATE ACÁ: https https,THE DUOPOLY WONDERS WHAT PDF LIVE IS JOIN HERE: https https
Parisi_oficial,1325658454875365376,1460347690827632650,NUESTRO INSTAGRAM CRECE IMPRESIONANTE POR DÍA! SÚMATE ACÁ https,OUR INSTAGRAM GROWS IMPRESSIVE BY DAY! JOIN HERE https
Parisi_oficial,1325658454875365376,1460343136929079296,SI QUIERES VER EL DEBATE DE HOY CON LOS 7 CANDIDATOS SIN CENSURA SIGUE NUESTRO CANAL OFICIAL https #ParisiEnDebateAnatel,IF YOU WANT TO WATCH TODAY'S DEBATE WITH THE 7 CANDIDATES WITHOUT CENSORSHIP FOLLOW OUR OFFICIAL CHANNEL https #ParisiEnDebateAnatel
Parisi_oficial,1325658454875365376,1460338049297096705,EL DUOPOLIO PENSÓ QUE CON ESTA NOS DEJABAN FUERA.  GRAVE ERROR PENSAR QUE EL PODER DE LA GENTE SE ELIMINA TAN FÁCIL. #ParisiEnDebateAnatel   EFECTO BOOMERANG https,THE DUOPOLY THOUGHT THAT WITH THIS ONE THEY WOULD LEAVE US OUT. IT IS A SERIOUS MISTAKE TO THINK THAT THE POWER OF THE PEOPLE IS ELIMINATED SO EASILY. #ParisiEnDebateAnatel   BOOMERANG EFFECT https
Parisi_oficial,1325658454875365376,1460315144861405197,¿YA TIENES DECIDIDO TU CANDIDATO A CORE DEL PARTIDO DE LA GENTE DE LA LISTA AB?,HAVE YOU ALREADY DECIDED YOUR CANDIDATE FOR THE CORE OF THE PARTY OF THE PEOPLE ON THE AB LIST?
Parisi_oficial,1325658454875365376,1460288911729737736,QUE SEA TENDENCIA TODO EL DIA Tendencia en Chile #ParisiEnDebateAnatel,MAKE IT TREND ALL DAY LONG TREND IN CHILE #ParisiEnDebateAnatel
Parisi_oficial,1325658454875365376,1460280092450430976,¿Ya tienes listo tu voto para el próximo domingo para diputado Distrito 7 @rodrigovattuone?  AB69 https,Do you already have your vote ready for next Sunday for Deputy District 7 @rodrigovattuone? AB69 https://
Parisi_oficial,1325658454875365376,1460279260166475777,Si nos niegan la democracia  vamos por ella  HOY A PARTIR DE LAS 19:30 HRS. NOS COLGAMOS DEL DEBATE ANATEL. Comenta con el hashtag #ParisiEnDebateAnatel y juntos hagamos un programa ÉPICPO EN 10 AÑOS NO HAN LOGRADO CALLARNOS  ESTA NO SERÁ LA EXCEPCIÓN. https,If we are denied democracy  we go for it TODAY FROM 19:30 HRS. WE GET HUNG UP ON THE ANATEL DEBATE. Comment with the hashtag #ParisiEnDebateAnatel and together let's make an EPIC program IN 10 YEARS THEY HAVE NOT MANAGED TO SHUT US UP  THIS WILL BE NO EXCEPTION. https
Parisi_oficial,1325658454875365376,1460270918165569546,Se agradece la valentía de anteponer las ideas por sobre el color político https,The courage to put ideas above political color is appreciated https
Parisi_oficial,1325658454875365376,1460261491635101699,HOY APAGA LA TELE Y SINTONIZA EL PDG LIVE. Si no nos dejaron estar  vamos a debatir igual  porque tenemos las ideas más vivas que nunca!!  Nos vemos por nuestros canales oficiales de Facebook y Youtube  a partir de las 19:30 hrs. https,TODAY TURN OFF THE TV AND TUNE IN TO THE PDG LIVE. If they did not let us be  we will debate the same  because we have the most vivid ideas than ever!!  See you on our official Facebook and Youtube channels  starting at 19:30 hrs. https
Parisi_oficial,1325658454875365376,1460074471709097984,Política · Tendencia #ParisiEnDebateAnatel 24 4 mil Tweets,Politics · Trend #ParisiEnDebateAnatel 24.4K Tweets
Parisi_oficial,1325658454875365376,1460072026941632515,Saludamos a Javier #Milei en #Argentina por tremenda votación y por el triunfo en su elección. https,We salute Javier #Milei in #Argentina for a tremendous vote and for the triumph in his election. https
Parisi_oficial,1325658454875365376,1460051023612071939,BUSCA TUS CANDIDATOS DEL PDG DE LA LISTA AB  https,SEARCH FOR YOUR CANDIDATES FROM THE PDG OF THE AB LIST  https
Parisi_oficial,1325658454875365376,1460038910046785541,AHORA BADBOYS EN VIVO #ParisiEnDebateAnatel,NOW BADBOYS LIVE #ParisiEnDebateAnatel
Parisi_oficial,1325658454875365376,1460038853071364102,TODOS TWITTEANDO #ParisiEnDebateAnatel,EVERYONE TWEETING #ParisiEnDebateAnatel
Parisi_oficial,1325658454875365376,1460029216708337670,Como  no nos dejaron participar. Lo haremos a nuestra manera y por nuestras redes sociales  si PARTICIPAREMOS del debate. No lo veas en los medios. Veelo por nuestras redes y responderemos todas las preguntas  HAGAMOS TENDENCIA #ParisiEnDebateAnatel https,Since they didn't let us participate. We will do it in our own way and through our social networks  if we will participate in the debate. Don't see it in the media. Watch it on our networks and we will answer all the questions  LET'S TREND #ParisiEnDebateAnatel https
Parisi_oficial,1325658454875365376,1460024928368009227,HAGAMOS TENDENCIA #ParisiEnDebateAnatel,LET'S TREND #ParisiEnDebateAnatel
